{
  "schemaVersion": "1.0",
  "repository": "https://github.com/morluto/rea",
  "commit": "f4cc6c85efe7f3513d587df3bd5086adb1bc6a76",
  "name": "rea",
  "description": "Reverse engineer anything with agents, from app behavior down to native binaries.",
  "defaultBranch": "main",
  "license": "MIT",
  "fetchedAt": "2026-10-26T07:34:35.608Z",
  "documents": [
    {
      "path": "README.md",
      "url": "https://github.com/morluto/rea/blob/f4cc6c85efe7f3513d587df3bd5086adb1bc6a76/README.md",
      "sha256": "4345ac9399af93fd50e916e01e40f8b364782374198dcb042218106d60c02c5c",
      "content": "<div align=\"center\">\n\n**English** · [简体中文](docs/readme/README_zh.md) · [繁體中文](docs/readme/README_zh-TW.md) · [日本語](docs/readme/README_ja.md) · [한국어](docs/readme/README_ko.md) · [Türkçe](docs/readme/README_tr.md) · [Русский](docs/readme/README_ru.md) · [Tiếng Việt](docs/readme/README_vi.md) · [ไทย](docs/readme/README_th.md) · [Deutsch](docs/readme/README_de.md) · [Español](docs/readme/README_es.md) · [Français](docs/readme/README_fr.md) · [Українська](docs/readme/README_uk.md) · [Polski](docs/readme/README_pl.md) · [Português (Brasil)](docs/readme/README_pt-BR.md) · [العربية](docs/readme/README_ar.md) · [فارسی](docs/readme/README_fa.md) · [Bahasa Indonesia](docs/readme/README_id.md) · [Italiano](docs/readme/README_it.md)\n· [Ελληνικά](docs/readme/README_el.md) · [മലയാളം](docs/readme/README_ml.md) · [Roman Urdu](docs/readme/README_ur-Latn.md) · [Română](docs/readme/README_ro.md)\n\n# REA: Reverse Engineer Anything\n\n### One MCP for reverse engineering across binaries, applications, and runtime behavior.\n\n**See a feature you like. Understand how it works, down to the binary level.**\n\n[![npm version](https://img.shields.io/npm/v/rea-agents?style=flat-square&color=cb3837)](https://www.npmjs.com/package/rea-agents)\n[![MCP tool catalog](https://img.shields.io/badge/MCP-tool_catalog-5c4ee5?style=flat-square)](docs/mcp-contracts.md#generated-catalog)\n[![Node.js requirements](https://img.shields.io/badge/Node.js-requirements-339933?style=flat-square&logo=nodedotjs&logoColor=white)](#what-you-can-analyze)\n[![skills.sh](https://skills.sh/b/morluto/rea?style=flat-square)](https://skills.sh/morluto/rea/reverse-engineer-anything)\n[![MIT license](https://img.shields.io/badge/license-MIT-f4c430?style=flat-square)](LICENSE)\n[![Discord](https://img.shields.io/discord/1556595354999332884?logo=discord&logoColor=white&label=Discord&color=5865F2)](https://discord.gg/GkcryMnJDM)\n\n<a href=\"https://trendshift.io/repositories/82054?utm_source=repository-badge&amp;utm_medium=badge&amp;utm_campaign=badge-repository-82054\" target=\"_blank\" rel=\"noopener noreferrer\"><img src=\"https://trendshift.io/api/badge/repositories/82054\" alt=\"morluto%2Frea | Trendshift\" width=\"250\" height=\"55\"/></a>\n\n**[Website](https://rea.tools/) · [Guides](https://rea.tools/guides/) · [Showcases](https://rea.tools/showcase/)**\n\n[Quick start](#quick-start) · [How REA works](#how-rea-works) · [What you can analyze](#what-you-can-analyze) · [Showcases](#showcases) · [Build RL environments](#build-rl-environments) · [FAQ](#faq) · [Documentation](#documentation)\n\n<code>npx rea-agents setup</code>\n\n</div>\n\n> [!IMPORTANT]\n> Get REA from [morluto/rea](https://github.com/morluto/rea),\n> [rea.tools](https://rea.tools/), or the [rea-agents npm package](https://www.npmjs.com/package/rea-agents).\n> Follow the installation and release links from these official sources. A similar\n> repository name or copied README does not establish that a download is official.\n\n<div align=\"center\">\n\n<br />\n\n<img src=\"docs/assets/rea-hopper-analysis.png\" alt=\"REA launching its analysis bridge inside Hopper while inspecting a native binary\" width=\"1200\" />\n\n<br /><br />\n\n<table aria-label=\"REA community\">\n<tr>\n<td align=\"center\" width=\"360\">\n  <a href=\"https://discord.gg/GkcryMnJDM\">\n    <img src=\"docs/assets/discord.svg\" height=\"42\" alt=\"Discord\" /><br />\n    <strong>Join the Reverse Engineering Community</strong>\n  </a><br />\n  <sub>Discord · Q&amp;A · Show and Tell</sub>\n</td>\n</tr>\n</table>\n\n<br />\n\n</div>\n\n---\n\nSee a feature in an app that you want in your own product? Ask your agent to investigate it with REA. It can inspect the app without its source code, explain how the feature works, show the evidence, and build a version for your project.\n\nREA connects your agent to tools for inspecting native binaries, JavaScript and Electron apps, .NET assemblies, and websites. You can also use the same tools from your terminal. Analysis runs locally, and results include the evidence and limitations behind each conclusion.\n\nSetup registers REA with your agent and installs matching workflow instructions. Native analysis can use an existing Hopper, Ghidra, or IDA installation; setup can optionally install Hopper with approval. Static JavaScript analysis needs no native analysis engine.\n\n> **[Visit the REA website](https://rea.tools/)** for setup instructions, illustrated guides, and real case studies.\n\n## Quick start\n\nOn Linux, Ghidra, JADX, firmware tool launches and static JavaScript/Electron\nanalysis require a procps-compatible `ps` on REA's `PATH` for process ownership\nchecks. Recovery steps are in `docs/installation.md` under\n\"Linux owned-process prerequisite\".\n\n### Set up your agent\n\nWith Node.js and npm installed, run:\n\n```bash\nnpx rea-agents setup\n```\n\nChoose your agents, review the proposed changes, and approve them. Setup adds\nREA's MCP server and matching workflow instructions, with backups of existing\nconfiguration. Restart your agent afterward.\n\nSetup supports Claude Code, Codex, Cursor, Gemini CLI, Grok Build and\n[other agents](docs/installation.md#supported-agents). See\n[installation and setup](docs/installation.md) for provider configuration and\nmanual MCP registration.\n\nMCP uses compact input schemas by default to reduce context overhead. Set\n`REA_MCP_INPUT_SCHEMA_PROFILE=full` in your MCP registration when you need the\ncomplete advertised field guidance and nested validation details. Both profiles\nkeep the full tool set and canonical server validation. See\n\"Compact input schema profile\" in the MCP contracts guide.\n\n### Ask your agent\n\n```text\nUnderstand how search works in the Notes app, show me the evidence, and build a\nsimilar feature for my project.\n```\n\nReplace Notes with your target app and the feature you want to understand.\n\n### Use the terminal\n\nInspect an extracted JavaScript/Electron app directory or ASAR:\n\n```bash\nnpx -y rea-agents@latest analyze-javascript-application /absolute/path/to/app --json\n```\n\nThe result includes modules, imports, Electron boundaries and their evidence.\nReplace the path with your target, such as `\"D:/apps/example\"` on Windows.\n\nTo install the `rea` command for regular use:\n\n```bash\nnpm install --global rea-agents\nrea --help\n```\n\nFor native analysis, configure a provider first. See the\n[CLI and Evidence guide](docs/cli.md) for native commands, provider selection,\nsnapshots and scripting.\n\n### Update REA\n\nREA changes quickly, and new releases include frequent bug fixes. Keep your\ninstallation up to date.\n\nFor a CLI installed with `npm install --global` or `bun add --global`:\n\n```bash\nrea update\n```\n\n`rea --update` is an alias for this verified workflow and accepts the same global\noutput flags. Use `rea update` when combining it with other command controls.\n\nUpdater commands retain at most 4 MiB of stdout and stderr combined. Oversized\nmetadata replies are rejected after the command exits; verbose installs continue\nwith bounded diagnostics. Human progress output respects terminal backpressure\nand waits for submitted writes to finish.\n\nBun global updates require Bun 1.2.17 or later. With an older Bun release,\nupgrade Bun manually before running `rea update`.\n\nTo refresh your agent registrations and skill, run the setup command printed\nby the update.\n\nIf you use `npx`, update your agent setup with:\n\n```bash\nnpx rea-agents@latest setup\n```\n\nReview the setup changes and restart your agent. For one-off CLI commands,\nuse `npx rea-agents@latest` followed by the command. With Bun, use\n`bunx rea-agents@latest` in place of `npx rea-agents@latest`.\n\n## How REA works\n\nYour agent calls REA through MCP to inspect the target and trace relevant code.\nREA returns findings with their evidence. The agent uses them to ask follow-up\nquestions, explain the behavior, or write and test an implementation.\nCLI commands use the same workflows.\n\n![REA investigation flow: your agent asks about a local target, REA inspects and traces it using analysis tools, and the agent uses the returned code, references and unknowns to explain, implement and test.](website/public/assets/figures/rea-investigation-flow.svg)\n\n[Open the full-size figure](website/public/assets/figures/rea-investigation-flow.svg).\n\n<a id=\"current-status\"></a>\n\n## What you can analyze\n\nREA requires Node.js 22.x (>=22.23.4), 24.x (>=24.22.1), or 26.12.1+, plus npm.\nAdditional tools and host support depend on the target:\n\n| Target                  | What REA returns                                                                                  | Requirements and guide                                                                                                                |\n| ----------------------- | ------------------------------------------------------------------------------------------------- | ------------------------------------------------------------------------------------------------------------------------------------- |\n| Desktop installations   | Runtime candidates, supporting files, component markers and next probes                           | Built-in bounded directory/header inspection; [desktop applications](docs/desktop-applications.md)                                    |\n| Native bina